[
  {
    "rule_id": "REG-001",
    "source_id": "wvo-2020",
    "article": "2.60",
    "topic": "Organisatie",
    "norm_type": "mandatory",
    "applies_when": "Regulier voortgezet onderwijs; toepasselijke schoolsoort en context bevestigd.",
    "rule_summary": "Het reglement bevat regels over organisatie en gang van zaken tijdens het eindexamen.",
    "verification_status": "draft",
    "primary_text_checked": true,
    "production_approved": false,
    "activation_status": "candidate_requires_human_approval",
    "valid_from": "2026-08-01",
    "valid_to": null,
    "legal_regime": "WVO 2020",
    "evidence": [
      {
        "fragment_id": "wvo-2020#Hoofdstuk2_Paragraaf5_Artikel2.60",
        "url": "https://wetten.overheid.nl/BWBR0044212/2026-08-01#Hoofdstuk2_Paragraaf5_Artikel2.60",
        "text_hash": "fef2c31aefc0be17fd6ea89c5664a2b939c79aeab3d8179092a02d0d0d40b8c2"
      }
    ],
    "check_method": "semantic_review",
    "limitations": "Beoordeel de volledige bepaling en documentcontext. Afwezigheid in tekst bewijst niet dat uitvoering ontbreekt.",
    "on_insufficient_evidence": "human_review",
    "suggested_action": "Vergelijk de schoolpassage met het volledige bronartikel; motiveer een eventueel wijzigingsvoorstel."
  },
  {
    "rule_id": "REG-002",
    "source_id": "wvo-2020",
    "article": "2.60",
    "topic": "Maatregelen",
    "norm_type": "mandatory",
    "applies_when": "Regulier voortgezet onderwijs; toepasselijke schoolsoort en context bevestigd.",
    "rule_summary": "Het reglement bevat informatie over toepassing van maatregelen uit WVO 2.61 lid 1.",
    "verification_status": "draft",
    "primary_text_checked": true,
    "production_approved": false,
    "activation_status": "candidate_requires_human_approval",
    "valid_from": "2026-08-01",
    "valid_to": null,
    "legal_regime": "WVO 2020",
    "evidence": [
      {
        "fragment_id": "wvo-2020#Hoofdstuk2_Paragraaf5_Artikel2.60",
        "url": "https://wetten.overheid.nl/BWBR0044212/2026-08-01#Hoofdstuk2_Paragraaf5_Artikel2.60",
        "text_hash": "fef2c31aefc0be17fd6ea89c5664a2b939c79aeab3d8179092a02d0d0d40b8c2"
      }
    ],
    "check_method": "semantic_review",
    "limitations": "Beoordeel de volledige bepaling en documentcontext. Afwezigheid in tekst bewijst niet dat uitvoering ontbreekt.",
    "on_insufficient_evidence": "human_review",
    "suggested_action": "Vergelijk de schoolpassage met het volledige bronartikel; motiveer een eventueel wijzigingsvoorstel."
  },
  {
    "rule_id": "REG-003",
    "source_id": "wvo-2020",
    "article": "2.60",
    "topic": "Inhalen en herkansen",
    "norm_type": "mandatory",
    "applies_when": "Regulier voortgezet onderwijs; toepasselijke schoolsoort en context bevestigd.",
    "rule_summary": "Het reglement regelt inhaal- en herkansingsmogelijkheden voor SE en voorziet in inhalen bij ziekte of bijzondere van de kandidaat onafhankelijke omstandigheden.",
    "verification_status": "draft",
    "primary_text_checked": true,
    "production_approved": false,
    "activation_status": "candidate_requires_human_approval",
    "valid_from": "2026-08-01",
    "valid_to": null,
    "legal_regime": "WVO 2020",
    "evidence": [
      {
        "fragment_id": "wvo-2020#Hoofdstuk2_Paragraaf5_Artikel2.60",
        "url": "https://wetten.overheid.nl/BWBR0044212/2026-08-01#Hoofdstuk2_Paragraaf5_Artikel2.60",
        "text_hash": "fef2c31aefc0be17fd6ea89c5664a2b939c79aeab3d8179092a02d0d0d40b8c2"
      }
    ],
    "check_method": "semantic_review",
    "limitations": "Lid 1 onder c. Niet gelijkstellen aan onbeperkt recht op nieuwe herkansingen. Lees 3.57 en concrete toetsgeschiedenis mee.",
    "on_insufficient_evidence": "human_review",
    "suggested_action": "Vergelijk de schoolpassage met het volledige bronartikel; motiveer een eventueel wijzigingsvoorstel."
  },
  {
    "rule_id": "REG-004",
    "source_id": "wvo-2020",
    "article": "2.60",
    "topic": "Commissie van beroep",
    "norm_type": "mandatory",
    "applies_when": "Regulier voortgezet onderwijs; toepasselijke schoolsoort en context bevestigd.",
    "rule_summary": "Het reglement bevat samenstelling en adres van de commissie van beroep.",
    "verification_status": "draft",
    "primary_text_checked": true,
    "production_approved": false,
    "activation_status": "candidate_requires_human_approval",
    "valid_from": "2026-08-01",
    "valid_to": null,
    "legal_regime": "WVO 2020",
    "evidence": [
      {
        "fragment_id": "wvo-2020#Hoofdstuk2_Paragraaf5_Artikel2.60",
        "url": "https://wetten.overheid.nl/BWBR0044212/2026-08-01#Hoofdstuk2_Paragraaf5_Artikel2.60",
        "text_hash": "fef2c31aefc0be17fd6ea89c5664a2b939c79aeab3d8179092a02d0d0d40b8c2"
      }
    ],
    "check_method": "semantic_review",
    "limitations": "Beoordeel de volledige bepaling en documentcontext. Afwezigheid in tekst bewijst niet dat uitvoering ontbreekt.",
    "on_insufficient_evidence": "human_review",
    "suggested_action": "Vergelijk de schoolpassage met het volledige bronartikel; motiveer een eventueel wijzigingsvoorstel."
  },
  {
    "rule_id": "REG-005",
    "source_id": "wvo-2020",
    "article": "2.60",
    "topic": "Vaststelling",
    "norm_type": "conditional",
    "applies_when": "Regulier voortgezet onderwijs; toepasselijke schoolsoort en context bevestigd.",
    "rule_summary": "Afwijken van het voorstel van de examencommissie vereist overleg en schriftelijke motivering; de motivering gaat naar commissie en MR.",
    "verification_status": "draft",
    "primary_text_checked": true,
    "production_approved": false,
    "activation_status": "candidate_requires_human_approval",
    "valid_from": "2026-08-01",
    "valid_to": null,
    "legal_regime": "WVO 2020",
    "evidence": [
      {
        "fragment_id": "wvo-2020#Hoofdstuk2_Paragraaf5_Artikel2.60",
        "url": "https://wetten.overheid.nl/BWBR0044212/2026-08-01#Hoofdstuk2_Paragraaf5_Artikel2.60",
        "text_hash": "fef2c31aefc0be17fd6ea89c5664a2b939c79aeab3d8179092a02d0d0d40b8c2"
      }
    ],
    "check_method": "semantic_review",
    "limitations": "Beoordeel de volledige bepaling en documentcontext. Afwezigheid in tekst bewijst niet dat uitvoering ontbreekt.",
    "on_insufficient_evidence": "human_review",
    "suggested_action": "Vergelijk de schoolpassage met het volledige bronartikel; motiveer een eventueel wijzigingsvoorstel."
  },
  {
    "rule_id": "REG-006",
    "source_id": "wvo-2020",
    "article": "2.60",
    "topic": "Bekendmaking",
    "norm_type": "procedural",
    "applies_when": "Regulier voortgezet onderwijs; toepasselijke schoolsoort en context bevestigd.",
    "rule_summary": "Het vastgestelde reglement wordt jaarlijks vóór 1 oktober aan kandidaten en Inspectie gezonden.",
    "verification_status": "draft",
    "primary_text_checked": true,
    "production_approved": false,
    "activation_status": "candidate_requires_human_approval",
    "valid_from": "2026-08-01",
    "valid_to": null,
    "legal_regime": "WVO 2020",
    "evidence": [
      {
        "fragment_id": "wvo-2020#Hoofdstuk2_Paragraaf5_Artikel2.60",
        "url": "https://wetten.overheid.nl/BWBR0044212/2026-08-01#Hoofdstuk2_Paragraaf5_Artikel2.60",
        "text_hash": "fef2c31aefc0be17fd6ea89c5664a2b939c79aeab3d8179092a02d0d0d40b8c2"
      }
    ],
    "check_method": "date_and_process_evidence",
    "limitations": "Lid 5. Publicatie op een website bewijst op zichzelf niet dat verzending heeft plaatsgevonden. Bewijs buiten het reglement nodig.",
    "on_insufficient_evidence": "human_review",
    "suggested_action": "Vergelijk de schoolpassage met het volledige bronartikel; motiveer een eventueel wijzigingsvoorstel."
  },
  {
    "rule_id": "ROL-001",
    "source_id": "wvo-2020",
    "article": "2.51a",
    "topic": "Examensecretaris",
    "norm_type": "procedural",
    "applies_when": "Regulier voortgezet onderwijs; toepasselijke schoolsoort en context bevestigd.",
    "rule_summary": "De rector/directeur wijst een of meer personeelsleden aan als examensecretaris en stelt een taakomschrijving vast.",
    "verification_status": "draft",
    "primary_text_checked": true,
    "production_approved": false,
    "activation_status": "candidate_requires_human_approval",
    "valid_from": "2026-08-01",
    "valid_to": null,
    "legal_regime": "WVO 2020",
    "evidence": [
      {
        "fragment_id": "wvo-2020#Hoofdstuk2_Paragraaf5_Artikel2.51a",
        "url": "https://wetten.overheid.nl/BWBR0044212/2026-08-01#Hoofdstuk2_Paragraaf5_Artikel2.51a",
        "text_hash": "255587c68b14e79a4bc272814c9befa79c0c577e6231712cb69a2e0e97f5194f"
      }
    ],
    "check_method": "semantic_review",
    "limitations": "Beoordeel de volledige bepaling en documentcontext. Afwezigheid in tekst bewijst niet dat uitvoering ontbreekt.",
    "on_insufficient_evidence": "human_review",
    "suggested_action": "Vergelijk de schoolpassage met het volledige bronartikel; motiveer een eventueel wijzigingsvoorstel."
  },
  {
    "rule_id": "ROL-002",
    "source_id": "wvo-2020",
    "article": "2.60d",
    "topic": "Examencommissie",
    "norm_type": "mandatory",
    "applies_when": "Regulier voortgezet onderwijs; toepasselijke schoolsoort en context bevestigd.",
    "rule_summary": "De examencommissie heeft een oneven aantal leden, ten minste drie.",
    "verification_status": "draft",
    "primary_text_checked": true,
    "production_approved": false,
    "activation_status": "candidate_requires_human_approval",
    "valid_from": "2026-08-01",
    "valid_to": null,
    "legal_regime": "WVO 2020",
    "evidence": [
      {
        "fragment_id": "wvo-2020#Hoofdstuk2_Paragraaf5_Artikel2.60d",
        "url": "https://wetten.overheid.nl/BWBR0044212/2026-08-01#Hoofdstuk2_Paragraaf5_Artikel2.60d",
        "text_hash": "d1b9553fa32ce46c69e43ae63f97a60895e1aeba448c7ef8137f45a35ab712c3"
      }
    ],
    "check_method": "deterministic_with_context",